song name,artist,album,track no,album artist,year
"1, 2, 3 (feat Jason Derulo & De La Ghetto) - Sofia Reyes",Sofia Reyes,"1, 2, 3 (feat. Jason Derulo & De La Ghetto)",0,"Charlie Guerrero, Delaghetto, Jason Derulo, Jon Leone, Nicole Zignago, Ricky Montaner, Sofia Reyes",2018
"Aaluma Doluma - Anirudh Ravichander, Badshah","Anirudh Ravichander, Badshah",Vedalam,0,Anirudh Ravichander,2015
"Ae Ajnabi - Udit Narayan, Mahalakshmi Iyer","Udit Narayan, Mahalakshmi Iyer",Dil Se,0,A.R. Rahman,1998
"Aeternum - John Lunn, Eivør","John Lunn, Eivør",The Last Kingdom (Original Television Soundtrack),0,"John Lunn, Eivør Pálsdottir, Marjun Syderbø Kjælnes",2018
"Agar Tum Saath Ho - Alka Yagnik, Arijit Singh","Alka Yagnik, Arijit Singh",Tamasha,0,A.R. Rahman,2015
"Ale Ale - AR Rahman, Karthik, Chitra Sivaraman, Siddharth, Genelia D'Souza","A.R. Rahman, Karthik, Chitra Sivaraman, Siddharth, Genelia D'Souza",Boys,0,A.R. Rahman,2003
"Annul Maelae - Harris Jayaraj, Sudha Ragunathan","Harris Jayaraj, Sudha Ragunathan",Vaaranam Aayiram,0,Harris Jayaraj,2008
"Apna Bana Le - Arijit Singh, Sachin-Jigar","Arijit Singh, Sachin-Jigar",Bhediya,0,Sachin-Jigar,2022
Apocalypse - Cigarettes After Sex,Cigarettes After Sex,Apocalypse,0,,2017
"Arabic Kuthu - Halamithi Habibo - Anirudh Ravichander, Jonita Gandhi","Anirudh Ravichander, Jonita Gandhi","Arabic Kuthu - Halamithi Habibo (From ""Beast"")",0,"Anirudh Ravichander, Sivakarthikeyan",2022
Armatopia - Johnny Marr,Johnny Marr,Armatopia,0,,2019
Battle Cry - Imagine Dragons,Imagine Dragons,Battle Cry,0,,2014
Battle Symphony - Linkin Park,Linkin Park,One More Light,0,,2017
Believer - Imagine Dragons,Imagine Dragons,Evolve,0,"Dan Reynolds, Wayne Sermon, Ben Mckee, Daniel Platzman, Robin Fredriksson, Mattias Larsson, Justin Tranter",2018
Black Water Lilies - Aurora,Aurora,All My Demons Greeting Me As A Friend (Deluxe),0,"Magnus Skylstad, Aurora Aksnes, Odd Martin Bergjord Skålnes",2016
Blank - Disfigure,Disfigure,Blank,0,,2013
Blue Jeans (Remastered 2011) - Lana Del Rey,Lana Del Rey,Born To Die - The Paradise Edition,0,"Emile Haynie, Lana Del Rey, Dan Heath",2012
Bones - Imagine Dragons,Imagine Dragons,Bones,0,"Dan Reynolds, Wayne Sermon, Ben Mckee, Daniel Platzman, Robin Fredriksson, Mattias Larsson",2022
Born To Die - Lana Del Rey,Lana Del Rey,Born To Die - The Paradise Edition,0,"Lana Del Rey, Justin Parker",2012
Can We Kiss Forever (Instrumental) - Kinà,Kinà,Things I Wanted To Tell You - Instrumental,0,"Kinà, Adriana Proenza",2020
Can We Kiss Forever - Kinà,Kinà,Can We Kiss Forever?,0,"Kinà, Adriana Proenza",2018
"Chahun Main Ya Naa - Palak Muchhal, Arijit Singh","Palak Muchhal, Arijit Singh",Aashiqui 2,0,Jeet Gannguli,2013
"Chaiyya Chaiyya - Sukhwinder Singh, Sapna Awasthi","Sukhwinder Singh, Sapna Awasthi",Dil Se,0,A.R. Rahman,1998
"Chammak Challo - Vishal & Shekhar, Akon","Vishal & Shekhar, Akon",Ra-One,0,Vishal &amp; Shekhar,2011
Chinna Chinna Asai - Minmini,Minmini,Roja,0,A.R. Rahman,2014
Chittiyaan Kalaiyaan - Meet Bros,Meet Bros,Roy,0,Meet Bros,2015
"Chop Shop - Tyler Bates, Joel J Richard","Tyler Bates, Joel J. Richard",John Wick,0,"Joel J. Richard, Tyler Bates",2014
Cold - Neffex,Neffex,Cold,0,,2018
Crystallize - Lindsey Stirling,Lindsey Stirling,Lindsey Stirling,0,"Lindsey Stirling, Marko Glogolja",2013
"Darkside - Alan Walker, AuRa, Tomine Harket","Alan Walker, Au/Ra, Tomine Harket",Darkside,0,"Alan Walker, Lars Kristian Rosness, Fredrik Borch Olsen, Marcus Arnbekk, Anders Frøen, Gunnar Greve, James Njie, Jesper Borgen, Tommy LaVerdi, Atle Pettersen, William Wiik Larsen, Jamie Aura Stenzel, Andrew Frampton",2018
Desi Kalakaar - Yo Yo Honey Singh,Yo Yo Honey Singh,Desi Kalakaar,0,Yo Yo Honey Singh,2014
"Despacito - Luis Fonsi, Daddy Yankee","Luis Fonsi, Daddy Yankee",Despacito,0,"Luis Fonsi, Erika Ender, Ramon Luis Ayala",2017
"Destiny Is All - John Lunn, Eivør","John Lunn, Eivør",The Last Kingdom (Original Television Soundtrack),0,"John Lunn, Eivør Pálsdottir, Marjun Syderbø Kjælnes",2018
"Diamond Heart - Sophia Somajo, Alan Walker","Sophia Somajo, Alan Walker",Diamond Heart,0,"Alan Walker, Sophia Somajo, Thomas Troelsen, James Njie, Kristoffer Haugan, Edvard Normann, Anders Frøen, Gunnar Greve, Yann Bargain, Victor Verpillat, Fredrik Borch Olsen",2018
"Dil Se Re - AR Rahman, Anuradha, Anupama","A.R. Rahman, Anuradha, Anupama",Dil Se,0,A.R. Rahman,1998
"Dilliwaali Girlfriend - Pritam, Arijit Singh, Sunidhi Chauhan","Pritam, Arijit Singh, Sunidhi Chauhan",Yeh Jawaani Hai Deewani,0,Pritam,2013
"Dippam Dappam - Anirudh Ravichander, Anthony Daasan","Anirudh Ravichander, Anthony Daasan","Dippam Dappam (From ""Kaathuvaakula Rendu Kaadhal"")",0,Anirudh Ravichander,2022
Don't Let Me Go - Cigarettes After Sex,Cigarettes After Sex,Cry,0,,2019
Dura - Daddy Yankee,Daddy Yankee,Dura,0,"Urbani Mota Cedeño, Luis Jorge Romero, Ramon Luis Ayala, Juan G. Rivera",2018
Elangathu solo - Sriram Parthasarathy,Sriram Parthasarathy,Pitaamagan,0,Ilaiyaraaja,2003
"En Sarwame - Nobin Paul, Ananya","Nobin Paul, Ananya","En Sarwame (From ""777 Charlie - Malayalam"")",0,"Nobin Paul, Ananya",2022
Ennavale Adi Ennavale - P Unnikrishnan,P. Unnikrishnan,Kaadhalan,0,A.R. Rahman,2014
Etho Sayana - Sachin Warrier,Sachin Warrier,10.30 AM Local Call,0,Gopi Sunder,2019
Faded - Alan Walker,Alan Walker,Faded,0,"Alan Walker, Jesper Borgen, Anders Frøen, Gunnar Greve",2015
Fuego Lento - Drake Bell,Drake Bell,Fuego Lento,0,,2019
"Gaandakannazhagi - Anirudh Ravichander, Neeti Mohan","Anirudh Ravichander, Neeti Mohan",Namma Veettu Pillai,0,D. Imman,2019
Galvanize (Edit) - The Chemical Brothers,The Chemical Brothers,Galvanize,0,The Chemical Brothers,2018
Gasolina - Daddy Yankee,Daddy Yankee,Barrio Fino (Bonus Track Version),0,"Ramón Luis Ayala Rodríguez, Eddie Avila",2004
"Gerua - Pritam, Arijit Singh, Antara Mitra","Pritam, Arijit Singh, Antara Mitra",Dilwale (Original Motion Picture Soundtrack),0,Pritam,2015
Goodbye - Apparat,Apparat,The Devil's Walk,0,,2013
Goodbye Brother - Ramin Djawadi,Ramin Djawadi,Game Of Thrones (Music From The HBO Series),0,Ramin Djawadi,2014
Guzarish - Javed Ali,Javed Ali,Ghajini,0,A.R. Rahman,2008
Half The World Away - Aurora,Aurora,All My Demons Greeting Me As A Friend (Deluxe),0,Noel Gallagher,2016
Hamari Adhuri Kahani - Arijit Singh,Arijit Singh,Hamari Adhuri Kahani (Original Motion Picture Soundtrack),0,Jeet Gannguli,2015
Harleys In Hawaii - Katy Perry,Katy Perry,Harleys In Hawaii,0,"Charlie Puth, Johan Carlsson, Katy Perry, Jacob Kasher Hindlin",2019
Heavenly - Cigarettes After Sex,Cigarettes After Sex,Heavenly,0,,2019
"Helig - John Lunn, Eivør","John Lunn, Eivør",The Last Kingdom (Original Television Soundtrack),0,"John Lunn, Eivør Pálsdottir",2018
"Hosanna - Vijay Prakash, Suzanne D'Mello, AR Rahman, Blaaze","Vijay Prakash, Suzanne D'Mello, A.R. Rahman, Blaaze",Vinnathaandi Varuvaayaa,0,A.R. Rahman,2010
"Hum Mar Jayenge - Tulsi Kumar, Arijit Singh","Tulsi Kumar, Arijit Singh",Aashiqui 2,0,Jeet Gannguli,2013
"Hum Naa Rahein Hum - Mithoon, Benny Dayal","Mithoon, Benny Dayal",Creature 3D,0,Mithoon,2014
"Humdard - Mithoon, Arijit Singh","Mithoon, Arijit Singh",Ek Villain,0,Mithoon,2014
I Don't Do Personals - Ramin Djawadi,Ramin Djawadi,Westworld: Season 3 (Music From The HBO Series),0,Ramin Djawadi,2020
"Ichu Ichu - Vijay Antony, Sangeetha Rajeshwaran","Vijay Antony, Sangeetha Rajeshwaran",Vedi,0,Vijay Antony,2011
"Ignite - Alan Walker, Julie Bergan, K-391","Alan Walker, Julie Bergan, K-391",Ignite,0,"Alan Walker, K-391, Mood Melodies, Fredrik Borch Olsen, Victor Thell, Maria Smith, Kristoffer Cezinando Karlsen",2018
"In My Mind - M86, Susie Q","M86, Susie Q",John Wick,0,"Ali Theodore, Susan Paroff, Sergio Cabral, Sarai Howard, Bryan Spitzer",2014
"In The End (Mellen Gi Remix) - Tommee Profitt, Fleurie, Mellen Gi","Tommee Profitt, Fleurie, Mellen Gi",In The End,0,"Chester Bennington, Mike Shinoda, Robert Bourdon, Joseph Hahn, Brad Delson",2019
Industry - Mire Kay,Mire Kay,Fortress,0,,2011
"Innum Konjam Naeram - Shweta Mohan, Vijay Prakash, AR Rahman","Shweta Mohan, Vijay Prakash, A.R. Rahman",Maryan,0,A.R. Rahman,2013
Invisible - Julius Dreisig & Zeus X Crona,Julius Dreisig & Zeus X Crona,Invisible,0,,2018
"Jeevamshamayi - Duet - KS Harisankar, Shreya Ghoshal","KS Harisankar, Shreya Ghoshal",Theevandi,0,Kailas Menon,2018
"Jingunamani - Ranjith, Sunidhi Chauhan, D Imman","Ranjith, Sunidhi Chauhan, D. Imman",Jilla,0,D. Imman,2013
"Jiya Jale - Lata Mangeshkar, MG Sreekumar","Lata Mangeshkar, M.G. Sreekumar",Dil Se,0,A.R. Rahman,1998
K - Cigarettes After Sex,Cigarettes After Sex,K.,0,,2016
"Kabhi Alvida Naa Kehna - Shankar-Ehsaan-Loy, Sonu Nigam, Alka Yagnik","Shankar-Ehsaan-Loy, Sonu Nigam, Alka Yagnik",Kabhi Alvida Naa Kehna,0,"Shankar Mahadevan, Ehsaan Noorani, Loy Mendonsa",2006
"Kal Ho Naa Ho - Shankar-Ehsaan-Loy, Sonu Nigam","Shankar-Ehsaan-Loy, Sonu Nigam",Kal Ho Naa Ho,0,"Shankar-Ehsaan-Loy, Shankar Mahadevan, Ehsaan Noorani, Loy Mendonsa",2003
"Kalasala Kalasala - Thaman S, L R Eswari, T Rajendar, Solar Sai","Thaman S, L. R. Eswari, T. Rajendar, Solar Sai",Why This Kolaveri Di? - Simply South,0,Thaman S,2012
"Kesariya - Pritam, Arijit Singh, Amitabh Bhattacharya","Pritam, Arijit Singh, Amitabh Bhattacharya","Kesariya (From ""Brahmastra"")",0,Pritam,2022
"Koi Tumsa Nahin - Sonu Nigam, Shreya Ghoshal","Sonu Nigam, Shreya Ghoshal",Krrish,0,Rajesh Roshan,2006
La Calin (CallmeArco Remix) - Serhat Durmus,Serhat Durmus,La Calin (CallmeArco Remix),0,Serhat Durmus,2023
Let Her Go - Passenger,Passenger,All the Little Lights (Deluxe),0,,2019
Love Me Like You Do - Ellie Goulding,Ellie Goulding,Fifty Shades Of Grey,0,"Max Martin, Ali Payami, Ilya Salmanzadeh, Savan Kotecha, Tove Lo",2015
Lungi Dance - Yo Yo Honey Singh,Yo Yo Honey Singh,Lungi Dance,0,Yo Yo Honey Singh,2013
"Lívstræðrir - John Lunn, Eivør","John Lunn, Eivør",The Last Kingdom (Original Television Soundtrack),0,"John Lunn, Eivør Pálsdottir",2018
MAYDAY - TheFatRat,TheFatRat,MAYDAY,0,"Christian F.J. Büttner, Kyle Kelso, Cecilia Gault",2018
Magenta Riddim - DJ Snake,DJ Snake,Carte Blanche,0,DJ Snake,2019
"Main Tera Boyfriend - Arijit Singh, Neha Kakkar","Arijit Singh, Neha Kakkar",Raabta,0,"Sourav Roy, Sohrabuddin",2017
"Malai Mangum Neram (Female Unplugged) - Deepthi Balasubramanian, Aakash Srinivasan","Deepthi Balasubramanian, Aakash Srinivasan",Malai Mangum Neram (Female Unplugged),0,Aakash Srinivasan,2022
Malai Mangum Neram - Prakash Nikki,Prakash Nikki,Rowthiram,0,Prakash Nikki,2011
"Manasellam Mazhaiye - Sonu Nigam, Saindhavi, GV Prakash Kumar","Sonu Nigam, Saindhavi, G.V. Prakash Kumar",Saguni,0,G.V. Prakash Kumar,2012
"Marana Mass - Anirudh Ravichander, S P Balasubrahmanyam","Anirudh Ravichander, S. P. Balasubrahmanyam",Petta (Original Motion Picture Soundtrack),0,Anirudh Ravichander,2018
Masakali Lofi - Aelo,Aelo,Masakali Lofi,0,,2022
Mayaanadhi - Shahabaz Aman,Shahabaz Aman,Mayaanadhi,0,"Shahabaz Aman, Rex Vijayan",2018
"Mehabooba - Ravi Basrur, Ananya Bhat","Ravi Basrur, Ananya Bhat",KGF Chapter 2,0,"Ravi Basrur, Ananya Bhat",2022
Memories - JFla,J.Fla,Memories,0,,2019
"Mental Manadhil - AR Rahman, Jonita Gandhi","A.R. Rahman, Jonita Gandhi",O Kadhal Kanmani,0,A.R. Rahman,2015
"Mere Haath Mein - Sunidhi Chauhan, Sonu Nigam, Jatin-Lalit, Prasoon Joshi","Sunidhi Chauhan, Sonu Nigam, Jatin-Lalit, Prasoon Joshi",Fanaa,0,Jatin-Lalit,2006
"Meri Aashiqui - Palak Muchhal, Arijit Singh","Palak Muchhal, Arijit Singh",Aashiqui 2,0,Mithoon,2013
"Minunundae Mullapolae - Ashwin Renju, Karthik, Manu Manjith, Tovino Thomas, Balu Varghese, Santhy Balachandran, Neha Iyer","Ashwin Renju, Karthik, Manu Manjith, Tovino Thomas, Balu Varghese, Santhy Balachandran, Neha Iyer",Tharangam,0,Ashwin Renju,2017
Mizhiyil - Shahabaz Aman,Shahabaz Aman,Mayaanadhi,0,"Shahabaz Aman, Rex Vijayan",2018
"Mohabbat Barsa De - Arko, Arjun, Arijit Singh, Samira Koppikar","Arko, Arjun, Arijit Singh, Samira Koppikar",Creature 3D,0,"Arko, Arjun",2014
"Mounam Chorum Neram - Rinu Razak, Shaan Rahman","Rinu Razak, Shaan Rahman",Ohm Shanthi Oshaana,0,Shaan Rahman,2014
"Mundhinam - Prashanthini, Harris Jayaraj, Naresh Iyer","Prashanthini, Harris Jayaraj, Naresh Iyer",Vaaranam Aayiram,0,Harris Jayaraj,2008
"Muskurane (Romantic) - Jeet Gannguli, Arijit Singh","Jeet Gannguli, Arijit Singh",Citylights,0,Jeet Gannguli,2014
"My England - John Lunn, Eivør","John Lunn, Eivør",The Last Kingdom (Original Television Soundtrack),0,"John Lunn, Eivør Pálsdottir",2018
"Naatu Naatu - Rahul Sipligunj, Kaala Bhairava, M M Keeravani","Rahul Sipligunj, Kaala Bhairava, M. M. Keeravani","Naatu Naatu (From ""RRR"")",0,,2021
Nainowale Ne - Neeti Mohan,Neeti Mohan,Padmaavat,0,Sanjay Leela Bhansali,2018
"Nanavare - Tessa Chavara, Vipin Lal, Lal","Tessa Chavara, Vipin Lal, Lal",Njandukalude Nattil Oridavela,0,Justin Varghese,2017
"Nee Himamazhayayi - Kailas Menon, K S Hari Shankar, Nithya Mammen","Kailas Menon, K. S. Hari Shankar, Nithya Mammen","Nee Himamazhayayi (From ""Edakkad Battalion 06"")",0,Kailas Menon,2019
"Neeyen Vennila - Haricharan, Chinmayi Sripada","Haricharan, Chinmayi Sripada",Cousins,0,M. Jayachandran,2014
Nenjae Yezhu - AR Rahman,A.R. Rahman,Maryan,0,A.R. Rahman,2013
"Nenjodu Cherthu - Sreejith - Saachin, Aalaap Raju","Sreejith - Saachin, Aalaap Raju",Yuvvh,0,"Sreejith Edavana, Saachin Raj Chelory",2012
Nervous - The Neighbourhood,The Neighbourhood,Hard To Imagine The Neighbourhood Ever Changing,0,"Jesse James Rutherford, Lars Stalfors, Zachary Abels, Jeremiah Freedman, Brandon Fried, Michael Margott, Benjamin Levin, Frank Dukes",2018
No Time for Caution - Hans Zimmer,Hans Zimmer,Interstellar  (Expanded Edition),0,Hans Zimmer,2014
Nothing's Gonna Hurt You Baby - Cigarettes After Sex,Cigarettes After Sex,EP I.,0,,2012
Ollulleru - Praseetha Chalakudy,Praseetha Chalakudy,Ajagajantharam,0,"Praseetha Chalakudy, Justin Varghese",2023
On My Mind - Ellie Goulding,Ellie Goulding,On My Mind,0,,2015
"On My Way - Alan Walker, Sabrina Carpenter, Farruko","Alan Walker, Sabrina Carpenter, Farruko",On My Way,0,"Alan Walker, Sabrina Carpenter, Julia Karlsson, Anton Rundberg, Jesper Borgen, Anders Frøen, Gunnar Greve, Fredrik Borch Olsen, Øyvind Sauvik, Carlos Efrén Reyes Rosado, Franklin Jovani Martínez, Marcos G. Pérez",2019
"One Two Three Four (Get On The Dance Floor) - Vishal & Shekhar, Vishal Dadlani, Hamsika Iyer, Sricharan Kasturirangan","Vishal & Shekhar, Vishal Dadlani, Hamsika Iyer, Sricharan Kasturirangan",Chennai Express,0,Vishal &amp; Shekhar,2013
Only Time - Enya,Enya,A Day Without Rain,0,,2000
Only Time - Róisín,Róisín,The Magic of Enya,0,,2009
Oru Dinam - Anand Bhaskar,Anand Bhaskar,Big Brother,0,Deepak Dev,2019
"Oru Vakkum (Version 1) - Alphons Jospeh, Mridula Warrier","Alphons Jospeh, Mridula Warrier",Big B,0,Alphons,2019
Oru Vakkum Mindathe - Vineeth Sreenivasan,Vineeth Sreenivasan,July 4,0,Ouseppachan,2019
"Pakka Local - Geetha Madhuri, Sagar","Geetha Madhuri, Sagar",Janatha Garage,0,Devi Sri Prasad,2016
"Param Sundari - AR Rahman, Shreya Ghoshal","A.R. Rahman, Shreya Ghoshal",Mimi,0,A.R. Rahman,2021
"Phir Mohabbat - Mohammed Irfan, Arijit Singh, Saim Bhat","Mohammed Irfan, Arijit Singh, Saim Bhat",Murder 2,0,"Mithoon, Mithoon",2011
"Pistah - Rajesh Murugesan, Shabareesh Varma","Rajesh Murugesan, Shabareesh Varma",Neram,0,Rajesh Murugesan,2013
"Poovukkul - AR Rahman, Sujatha Mohan, P Unnikrishnan","A.R. Rahman, Sujatha Mohan, P Unnikrishnan",Jeans,0,A.R. Rahman,1998
"Pudhu Vellai Mazhai - Unni Menon, Sujatha Mohan","Unni Menon, Sujatha Mohan",Roja,0,A.R. Rahman,2014
Pullikkuyile - Sujatha Mohan,Sujatha Mohan,Annyar,0,Mohan Sithara,2019
"Puthiyoru Lokam - Hesham Abdul Wahab, Vimal Roy, Bhadra Rajin","Hesham Abdul Wahab, Vimal Roy, Bhadra Rajin",Hridayam,0,Hesham Abdul Wahab,2022
"Puthumazhayai (Shreya Ghoshal) - Shreya Ghoshal, Gopi Sunder","Shreya Ghoshal, Gopi Sunder",Charlie,0,Gopi Sunder,2015
"Pyaar Ki Ek Kahani - Sonu Nigam, Shreya Ghoshal","Sonu Nigam, Shreya Ghoshal",Krrish,0,Rajesh Roshan,2006
Radioactive - Imagine Dragons,Imagine Dragons,Radioactive,0,"Josh Mosser, Kendrick Lamar, A. Grant, Dan Reynolds, Wayne Sermon, Ben Mckee",2014
Ready Steady Go (Korean Style) - Paul Oakenfold,Paul Oakenfold,Ready Steady Go (Korean Style),0,,2020
"Ringa Ringa - Devi Sri Prasad, Priya Hemesh","Devi Sri Prasad, Priya Hemesh",Aarya - 2,0,Devi Sri Prasad,2009
Roar - Katy Perry,Katy Perry,Roar,0,"Max Martin, Katy Perry, Lukasz Gottwald, Bonnie Mckee, Henry Walter",2013
Runaway - Aurora,Aurora,All My Demons Greeting Me As A Friend (Deluxe),0,"Magnus Skylstad, Aurora Aksnes",2016
"Runaway - Laura Brehm, Nikonn","Laura Brehm, Nikonn",Runaway,0,"Laura Brehm, Nikolaos Bitzenis",2022
Running With The Wolves - Aurora,Aurora,All My Demons Greeting Me As A Friend (Deluxe),0,"Nicolas Rebscher, Aurora Aksnes, Michelle Leonard",2016
"Sadda Dil Vi Tu (Ga Ga Ga Ganpati) - Sachin-Jigar, Hard Kaur","Sachin-Jigar, Hard Kaur",ABCD - Any Body Can Dance,0,"Sachin Sanghvi, Jigar Saraiya",2013
"Samjhawan - Jawad Ahmad, Toshi Sabri, Arijit Singh, Shreya Ghoshal","Jawad Ahmad, Toshi Sabri, Arijit Singh, Shreya Ghoshal",Humpty Sharma Ki Dulhania (Original Motion Picture Soundtrack),0,"Jawad Ahmad, Sharib Sabri, Toshi Sabri",2014
"Sanam Re - Arijit Singh, Mithoon","Arijit Singh, Mithoon",Sanam Re,0,Mithoon,2016
"Sapna Jahan - Ajay-Atul, Sonu Nigam, Neeti Mohan","Ajay-Atul, Sonu Nigam, Neeti Mohan",Brothers,0,"Ajay Gogavale, Atul Gogavale",2015
"Sawan Aaya Hai - Tony Kakkar, Mithoon, Arijit Singh","Tony Kakkar, Mithoon, Arijit Singh",Creature 3D,0,"Tony Kakkar, Mithoon",2014
Sceptic Heart - Black Red Gold,Black Red Gold,Melancholic Indie Pop,0,"Freddie Dickson, Owen Barnaby",2021
"Senthoora - D Imman, Luksimi Sivaneswaralingam","D. Imman, Luksimi Sivaneswaralingam",Bogan,0,D. Imman,2016
"Sil Sil Sil Sillala - P Unnikrishnan, Sujatha Mohan","P. Unnikrishnan, Sujatha Mohan",Unnai Ninaithu,0,"P. Unnikrishnan, Sujatha Mohan, Sirpy, Pa.Vijay",2002
Sing Me to Sleep - Alan Walker,Alan Walker,Sing Me to Sleep,0,"Alan Walker, Jesper Borgen, Anders Frøen, Iselin Solheim, Gunnar Greve, Tommy La Verdi, Magnus Bertelsen",2016
Sky High - Elektronomia,Elektronomia,Sky High,0,,2016
Skyfall - Adele,Adele,Skyfall,0,"Adele Adkins, Paul Epworth",2012
"Sonapareeya - Javed Ali, Nakash Aziz, AR Rahman, Haricharan","Javed Ali, Nakash Aziz, A.R. Rahman, Haricharan",Maryan,0,A.R. Rahman,2013
Space Song (Beach House Cover) - Alles Club,Alles Club,Emballage,0,Alles Club,2021
Still DRE (Instrumental) - Dr Dre,Dr. Dre,2001 Instrumental,0,"Andre R. Young, Melvin Charles Bradford, Shawn Carter, Scott Storch",2008
"Subha Hone Na De - Mika Singh, Shefali Alvares","Mika Singh, Shefali Alvares",Desi Boyz,0,Pritam,2011
"Taal Se Taal - Alka Yagnik, Udit Narayan","Alka Yagnik, Udit Narayan",Taal,0,"Alka Yagnik, Udit Narayan, A.R. Rahman",1999
Take Me To Church - Hozier,Hozier,Hozier,0,Andrew Hozier-Byrne,2014
"Tere Bina - AR Rahman, Chinmayi Sripada, Murtuza Khan, Qadir Khan","A.R. Rahman, Chinmayi Sripada, Murtuza Khan, Qadir Khan",Guru (Original Motion Picture Soundtrack),0,A.R. Rahman,2006
"The Rains of Castamere - Ramin Djawadi, Serj Tankian","Ramin Djawadi, Serj Tankian",Game Of Thrones: Season 8 (Music from the HBO Series),0,,2019
The Spectre - Alan Walker,Alan Walker,The Spectre,0,"Alan Walker, Anders Frøen, Jesper Borgen, Lars Kristian Rosness, Marcus Arnbekk",2017
These Are My Feelings - MrFIRA,Mr.FIRA,These Are My Feelings,0,,2021
Think - Kaleida,Kaleida,Tear the Roots,0,,2017
"Thumbi Penne - Gopi Sunder, Siddharth Menon","Gopi Sunder, Siddharth Menon",Bangalore Days,0,Gopi Sunder,2014
Thunder - Imagine Dragons,Imagine Dragons,Evolve,0,"Jayson Dezuzio, Dan Reynolds, Wayne Sermon, Ben Mckee, Daniel Platzman, A. Grant",2018
Time - Hans Zimmer,Hans Zimmer,Inception (Music from the Motion Picture),0,Hans Zimmer,2010
"Titli - Vishal & Shekhar, Chinmayi Sripada, Gopi Sunder","Vishal & Shekhar, Chinmayi Sripada, Gopi Sunder",Chennai Express,0,Vishal &amp; Shekhar,2013
Trust Each Other - Ramin Djawadi,Ramin Djawadi,Game of Thrones (Music from the HBO® Series - Season 6),0,Ramin Djawadi,2016
Tum Hi Ho - Arijit Singh,Arijit Singh,Aashiqui 2,0,Mithoon,2013
"Tum Tum - Aishwarya Kumar, Darshana Menon, Reena Gilbert, Vidhya Gopal, Yashika Sikka, Thaman S","Aishwarya Kumar, Darshana Menon, Reena Gilbert, Vidhya Gopal, Yashika Sikka, Thaman S","Tum Tum (From ""Enemy - Hindi"")",0,"Thaman S, Aishwarya Kumar, Darshana Menon, Reena Gilbert, Vidhya Gopal, Yashika Sikka",2022
"Tum Tum - Satya Yamini, Tejaswini, Srivardhini, Aditi Bhavaraju, Roshini JKV, Thaman S","Satya Yamini, Tejaswini, Srivardhini, Aditi Bhavaraju, Roshini JKV, Thaman S","Tum Tum (From ""Enemy - Tamil"")",0,"Thaman S, Srivardhini, Aditi Bhavaraju, Satya Yamini, Roshini JKV, Tejaswini",2021
"Tumhi Dekho Naa - Shankar-Ehsaan-Loy, Sonu Nigam, Alka Yagnik","Shankar-Ehsaan-Loy, Sonu Nigam, Alka Yagnik",Kabhi Alvida Naa Kehna,0,"Shankar Mahadevan, Ehsaan Noorani, Loy Mendonsa",2006
"Unakkul Naane - Rohini, Harris Jayaraj, Pritt, Dilushselva","Rohini, Harris Jayaraj, Pritt, Dilushselva",Unakkul Naane,0,"Harris Jayaraj, Rohini, Pritt, Dilushselva",2023
"Unn Perai Sollum - GV Prakash Kumar, Naresh Iyer, Shreya Ghoshal, Haricharan","G.V. Prakash Kumar, Naresh Iyer, Shreya Ghoshal, Haricharan",Angadi Theru,0,"G.V. Prakash Kumar, Naresh Iyer, Shreya Ghoshal, Haricharan",2010
Uska Hi Banana - Arijit Singh,Arijit Singh,1920 Evil Returns,0,Chirantann Bhatt,2012
"Usure Pogudhey - AR Rahman, Karthik","A.R. Rahman, Karthik",Raavanan,0,A.R. Rahman,2010
"Uyiril Thodum - Sooraj Santhosh, Anne Amie","Sooraj Santhosh, Anne Amie",Kumbalangi Nights,0,Sushin Shyam,2019
"Vaathi Coming - Anirudh Ravichander, Gana Balachandar","Anirudh Ravichander, Gana Balachandar",Master,0,Anirudh Ravichander,2020
Vertigo (Spitfya Remix) - Rob Gasser & Laura Brehm,Rob Gasser & Laura Brehm,Vertigo (Spitfya Remix),0,,2018
"Vibin' Out - FKJ, ((( O )))","FKJ, ((( O )))",French Kiwi Juice,0,Vincent Fenton,2017
Warrior - Aurora,Aurora,Warrior,0,,2016
Welcome to the Fire - Willyecho,Willyecho,Welcome to the Fire,0,,2017
"Yaarindha Devadhai, Pt 1 - Hariharan",Hariharan,Unnai Ninaithu,0,"Hariharan, Sirpy, Ravishankar",2002
"Yaarindha Devadhai, Pt 2 - Unnimenon",Unnimenon,Unnai Ninaithu,0,"Unnimenon, Sirpy, Ravishankar",2002
"Zaroorat - Mithoon, Mustafa Zahid","Mithoon, Mustafa Zahid",Ek Villain,0,Mithoon,2014
cotton candy - Iris,Iris,femme florale,0,"Mathias Wang, Vilde Iris Hartveit Kolltveit, Askjell Solstrand",2019
creature - Iris,Iris,femme florale,0,"Jonathan Kluth, Vilde Iris Hartveit Kolltveit, Charles Grant",2019
from inside a car - Iris,Iris,a sensitive being,0,"Askjell Solstrand, Kolltveit Vilde Hartveit",2019
giving in - Iris,Iris,a sensitive being,0,"Ian Barter, Peder Niilas, Alexander Pavelich, Kolltveit Vilde Hartveit",2019
hanging around youcrackers - Iris,Iris,a sensitive being,0,"Vetle Junker, Kolltveit Vilde Hartveit",2019
hidden springs - Iris,Iris,femme florale,0,"Vetle Junker, Vilde Iris Hartveit Kolltveit",2019
repose - Iris,Iris,a sensitive being,0,"Vetle Junker, Vilde Iris Hartveit Kolltveit",2019
"your mind, the universe - Iris",Iris,"your mind, the universe",0,"Vetle Junker, Vilde Iris Hartveit Kolltveit",2019
İzmir Marşı - Coldrex,Coldrex,İzmir Marşı,0,,2022
